{
	"$schema":	"http://json-schema.org/draft-07/schema#",
	"type":	"object",
	"properties":	{
		"department":	{
			"type":	["object", "null"]
		},
		"tags":	{
			"type":	["array", "null"]
		},
		"active":	{
			"type":	"boolean"
		},
		"email":	{
			"type":	"string"
		},
		"name":	{
			"type":	"string"
		},
		"id":	{
			"type":	"integer"
		}
	},
	"required":	["active", "email", "name", "id"]
}
